{
    "$schema":  "../../Schemas/project_world_generated_manifest.schema.json",
    "schema_version":  1,
    "scope_id":  "presentation_kazan_representative_v1",
    "generation":  8,
    "owning_layer":  "presentation",
    "accepted_operation_id":  "65a3e193d5f146c5bb226ee1eceb684d",
    "generator_fingerprint":  "290f20007092af4339209c254361b371af0f363306f546eba87a13a91f43a00c",
    "input_identity":  {
                           "runtime_profile_sha256":  "none",
                           "map_package":  "shared",
                           "compile_result_sha256":  "none",
                           "presentation_profile_sha256":  "0a4f4eeeab7e73f719d290df4d156aaa09d5568575c318c7237197db98be8d79"
                       },
    "artifacts":  [
                      {
                          "path":  "Plugins/World/ProjectWorld/Content/Generated/Presentation/MI_ProjectWorldTerrain_kazan_representative_v1.uasset",
                          "kind":  "asset",
                          "digest_kind":  "sha256",
                          "digest":  "8e6a4fe02e0f32d8dfe46c7cde21ea15bb9d70068c43685441c568343bb3029b"
                      }
                  ],
    "consumer_references":  [
                                "map_p0_l_projectworldkazan",
                                "map_p0_l_projectworldsynthetic",
                                "map_representative_l_projectworldkazan_representative",
                                "map_representative_l_projectworldsynthetic_representative"
                            ]
}
