{
    "$schema":  "../../../../ProjectWorld/Data/Schemas/project_world_generated_manifest.schema.json",
    "schema_version":  1,
    "scope_id":  "layer_kazan_territory_v1_gameplay",
    "generation":  20,
    "owning_layer":  "gameplay",
    "accepted_operation_id":  "ae2579df0cc24693830bb081b8e29b05",
    "accepted_at_utc":  "2026-09-26T11:38:58.8877454+00:00",
    "generator_fingerprint":  "502c424f948b425c8fdb6c4ab7706e2aaf5c7a95bcac1c24a2c48634a8639897",
    "input_identity":  {
                           "map_package":  "/ProjectWorldData/Generated/Territory/L_ProjectWorldKazanTerritory",
                           "runtime_profile_sha256":  "none",
                           "authored_overlay_profile_sha256":  "e2fae4e6e95d79fa2568279ffd6365fd6d2bd52a861dc77d8feef2f8a841870d",
                           "compile_result_sha256":  "cebad191550bf4b7177514ca960787b5dfc1095a5771efefff81d96bb89f2d70",
                           "presentation_profile_sha256":  "de1a92306f3ce383b5ac04f82e5892d100460b286690b86d9cb93ac4da108a36"
                       },
    "artifacts":  [
                      {
                          "path":  "Plugins/World/ProjectWorldData/Content/__ExternalActors__/Generated/Territory/L_ProjectWorldKazanTerritory/E/F0/ZX81E2ZR7TCHBKAQA58X0C.uasset",
                          "kind":  "external_actor",
                          "digest_kind":  "sha256",
                          "digest":  "b1a1de1d3cedd319ded887c80d6fc45c28f07529008f4293389e3c551e85577e"
                      },
                      {
                          "path":  "Plugins/World/ProjectWorldData/Content/__ExternalActors__/Generated/Territory/L_ProjectWorldKazanTerritory/8/BL/3LN7N2GXHKGIG3RP8XSCPT.uasset",
                          "kind":  "external_actor",
                          "digest_kind":  "sha256",
                          "digest":  "0e75228925487a63dcd67cd064e0fb9f2b3fca47a66ec018e5b39c90b09bd45e"
                      },
                      {
                          "path":  "Plugins/World/ProjectWorldData/Content/__ExternalActors__/Generated/Territory/L_ProjectWorldKazanTerritory/5/6A/8NR90SKLY5T1QRTV64R28M.uasset",
                          "kind":  "external_actor",
                          "digest_kind":  "sha256",
                          "digest":  "ba79e5a112c3e070632e171ea955a8290dc75e66fa446ca12dff9f79eddaa424"
                      }
                  ],
    "consumer_references":  [
                                "map_territory_l_projectworldkazanterritory"
                            ],
    "layer_contract":  {
                           "realization_profile_id":  "kazan_territory_v1",
                           "realization_profile_sha256":  "87f4c30a1acb8a71e34f5975a9818ddd3d24d0059d47aac0a63223f6bf08cbd6",
                           "normalized_layer_contract_sha256":  "c98b349c82422a8c92f8232617d254207ae8d476df36fa327674ddcc9a5e01d6",
                           "generator_id":  "project_gameplay_placement",
                           "generator_version":  1,
                           "artifact_root":  "/ProjectWorldData/Generated/Territory/Gameplay/",
                           "canonical_inputs":  [
                                                    {
                                                        "unit_id":  "kazan_water_cache_01",
                                                        "sha256":  "9791e64d2da6acb795e71981da84e12ae721b298007a0e25c3d5fd11866d4d70"
                                                    },
                                                    {
                                                        "unit_id":  "kazan_water_cache_02",
                                                        "sha256":  "4a45b8c26ca85993e918799cfc269ab54bd52370b918a33c78841a93c6c3cbb5"
                                                    },
                                                    {
                                                        "unit_id":  "kazan_water_cache_03",
                                                        "sha256":  "cc7594f42446f772c79d8510dbe439496dab77165992f18a10d4ca7027aa7468"
                                                    }
                                                ],
                           "dependency_inputs":  [
                                                     {
                                                         "unit_id":  "layer:terrain:contract",
                                                         "sha256":  "4fd21e8defdb01cc069d0804c71b3c2760039038832354f26decfd313ceb91e8"
                                                     }
                                                 ],
                           "final_dirty_units":  [
                                                     "*"
                                                 ],
                           "semantic_outputs":  [
                                                    {
                                                        "artifact_path":  "Plugins/World/ProjectWorldData/Content/__ExternalActors__/Generated/Territory/L_ProjectWorldKazanTerritory/5/6A/8NR90SKLY5T1QRTV64R28M.uasset",
                                                        "semantic_sha256":  "9791e64d2da6acb795e71981da84e12ae721b298007a0e25c3d5fd11866d4d70"
                                                    },
                                                    {
                                                        "artifact_path":  "Plugins/World/ProjectWorldData/Content/__ExternalActors__/Generated/Territory/L_ProjectWorldKazanTerritory/8/BL/3LN7N2GXHKGIG3RP8XSCPT.uasset",
                                                        "semantic_sha256":  "4a45b8c26ca85993e918799cfc269ab54bd52370b918a33c78841a93c6c3cbb5"
                                                    },
                                                    {
                                                        "artifact_path":  "Plugins/World/ProjectWorldData/Content/__ExternalActors__/Generated/Territory/L_ProjectWorldKazanTerritory/E/F0/ZX81E2ZR7TCHBKAQA58X0C.uasset",
                                                        "semantic_sha256":  "cc7594f42446f772c79d8510dbe439496dab77165992f18a10d4ca7027aa7468"
                                                    }
                                                ]
                       }
}
