{
    "$schema":  "../../../../ProjectWorld/Data/Schemas/project_world_generated_manifest.schema.json",
    "schema_version":  1,
    "scope_id":  "map_p0_l_projectworldkazan",
    "generation":  2,
    "owning_layer":  "map",
    "accepted_operation_id":  "f4630d9f01794212ae9141074b692db7",
    "accepted_at_utc":  "2026-08-11T14:15:52.3682600+00:00",
    "generator_fingerprint":  "ed8d4672e9523eca4a39723c891386f76258113f1b73859e9c006f100da5986f",
    "input_identity":  {
                           "map_package":  "/ProjectWorldData/Generated/P0/L_ProjectWorldKazan",
                           "runtime_profile_sha256":  "none",
                           "authored_overlay_profile_sha256":  "e2fae4e6e95d79fa2568279ffd6365fd6d2bd52a861dc77d8feef2f8a841870d",
                           "compile_result_sha256":  "3082e02c1dc2c47a1d7d463c5ea86f37f5224ee8410e79eaabefbf1bfac01891",
                           "presentation_profile_sha256":  "9a15a0b200f4c86081d831603da397a215ed086d4dd4574e803fd2ccab328cd2"
                       },
    "artifacts":  [
                      {
                          "path":  "Plugins/World/ProjectWorldData/Content/__ExternalActors__/Generated/P0/L_ProjectWorldKazan/2/HE/CSTGX66RLWS3II461ER8QL.uasset",
                          "kind":  "external_actor",
                          "digest_kind":  "sha256",
                          "digest":  "2032498575341cf2b64011ca0279c2775adb05c0b90fa339a7efc44fcbe47452"
                      },
                      {
                          "path":  "Plugins/World/ProjectWorldData/Content/__ExternalActors__/Generated/P0/L_ProjectWorldKazan/3/8A/BINOGVFMYTPJGAH3QC4IMU.uasset",
                          "kind":  "external_actor",
                          "digest_kind":  "sha256",
                          "digest":  "4674d1e2729a978ce9caae1d5acf450d982588cf14ce60650dd60fb4051e59ff"
                      },
                      {
                          "path":  "Plugins/World/ProjectWorldData/Content/__ExternalActors__/Generated/P0/L_ProjectWorldKazan/3/N6/YKUP5KROVXPR1PGXLO4X6T.uasset",
                          "kind":  "external_actor",
                          "digest_kind":  "sha256",
                          "digest":  "0dd39dd1f27c313c866bb30008a0503d7c1d326affc4394fa656307f2ae03a9c"
                      },
                      {
                          "path":  "Plugins/World/ProjectWorldData/Content/__ExternalActors__/Generated/P0/L_ProjectWorldKazan/4/AS/NY0PJYK6DVQICLDMUUA0CT.uasset",
                          "kind":  "external_actor",
                          "digest_kind":  "sha256",
                          "digest":  "f6da6e935e741e87914a9003d6f0d8450bf22e93e0fd2f2948313c963e608824"
                      },
                      {
                          "path":  "Plugins/World/ProjectWorldData/Content/__ExternalActors__/Generated/P0/L_ProjectWorldKazan/4/T0/4A4TGRZ2R1Y41GC0CODM18.uasset",
                          "kind":  "external_actor",
                          "digest_kind":  "sha256",
                          "digest":  "2393d1082806925b8d3b54a0d773bc650ade556758f300ef751b0fa116b2d3a0"
                      },
                      {
                          "path":  "Plugins/World/ProjectWorldData/Content/__ExternalActors__/Generated/P0/L_ProjectWorldKazan/5/9Z/7DJ1N7A6SN82072W7ZP3G4.uasset",
                          "kind":  "external_actor",
                          "digest_kind":  "sha256",
                          "digest":  "6df1e6a55977ec0582c671671649bba4fcf0137d9830069743c271a0b15d150d"
                      },
                      {
                          "path":  "Plugins/World/ProjectWorldData/Content/__ExternalActors__/Generated/P0/L_ProjectWorldKazan/6/G9/BD0T96R99D3I6LAW6FSFES.uasset",
                          "kind":  "external_actor",
                          "digest_kind":  "sha256",
                          "digest":  "e7299166a7b8dddf5a5f5a6478faae280082849fb9e3ca024fbdafa57ae3f487"
                      },
                      {
                          "path":  "Plugins/World/ProjectWorldData/Content/__ExternalActors__/Generated/P0/L_ProjectWorldKazan/7/4L/OGKXHN4J10A4Y06N1DO0BH.uasset",
                          "kind":  "external_actor",
                          "digest_kind":  "sha256",
                          "digest":  "ede0c0e0d5667e3f712a1b1354642522e73efcc87aa8c59f0953cf839b30559b"
                      },
                      {
                          "path":  "Plugins/World/ProjectWorldData/Content/__ExternalActors__/Generated/P0/L_ProjectWorldKazan/8/8Q/HKT82M4TH6NLD2WS4VYH0G.uasset",
                          "kind":  "external_actor",
                          "digest_kind":  "sha256",
                          "digest":  "83a4e187b017952a2bfc3b13a71a5b5122b2d242e4f3f3c8fa2fc3b9fa45e2bc"
                      },
                      {
                          "path":  "Plugins/World/ProjectWorldData/Content/__ExternalActors__/Generated/P0/L_ProjectWorldKazan/A/NK/L3XHBBM6ZL0ZHEZSGVIOL0.uasset",
                          "kind":  "external_actor",
                          "digest_kind":  "sha256",
                          "digest":  "ed1efe224e4f9156efaf267cb365fecea6559e2d52216f4afe9bdc5d81310e55"
                      },
                      {
                          "path":  "Plugins/World/ProjectWorldData/Content/__ExternalActors__/Generated/P0/L_ProjectWorldKazan/B/46/U4SYTG8Y5GHOVVL8BV5OT3.uasset",
                          "kind":  "external_actor",
                          "digest_kind":  "sha256",
                          "digest":  "4e230aecaf9052b606f29f9d74f6351ba4746651ae20f0069fdd0ea568244bbf"
                      },
                      {
                          "path":  "Plugins/World/ProjectWorldData/Content/__ExternalActors__/Generated/P0/L_ProjectWorldKazan/B/72/5D86SCPMV3L7H4R9EQDU5U.uasset",
                          "kind":  "external_actor",
                          "digest_kind":  "sha256",
                          "digest":  "fe609b6869cbe4c5c6e7e6e6c7c1b5bfd98e42436e09849d672eb8441a8c25ca"
                      },
                      {
                          "path":  "Plugins/World/ProjectWorldData/Content/__ExternalActors__/Generated/P0/L_ProjectWorldKazan/D/54/8SZRD6U7SL316SHNAZGWY8.uasset",
                          "kind":  "external_actor",
                          "digest_kind":  "sha256",
                          "digest":  "d0f03f9e803208dbf10a784d2cc020d4b83cacdf8c9083bd4e49ca109d0eaaf3"
                      },
                      {
                          "path":  "Plugins/World/ProjectWorldData/Content/__ExternalActors__/Generated/P0/L_ProjectWorldKazan/D/KJ/HAE8KSI5ZYOUPZ16Q0MQUI.uasset",
                          "kind":  "external_actor",
                          "digest_kind":  "sha256",
                          "digest":  "922f0be812aa4c0ddb59652f6f5a4d6257ec421fd9f4d5f9701e8e839cfbbe43"
                      },
                      {
                          "path":  "Plugins/World/ProjectWorldData/Content/__ExternalActors__/Generated/P0/L_ProjectWorldKazan/E/9P/7VXFC28WI0DQ7669TPRCLR.uasset",
                          "kind":  "external_actor",
                          "digest_kind":  "sha256",
                          "digest":  "dd751f8e6c065caa456879e8a3a1ff353f76cec05abdb2bd0e140003b0efe12c"
                      },
                      {
                          "path":  "Plugins/World/ProjectWorldData/Content/__ExternalActors__/Generated/P0/L_ProjectWorldKazan/E/UE/F7VX278KCWL2F3P4Y8NH1D.uasset",
                          "kind":  "external_actor",
                          "digest_kind":  "sha256",
                          "digest":  "649826dbea5f7351c9a957fc0e321fc87d46680a297537053891e13f95d341c7"
                      },
                      {
                          "path":  "Plugins/World/ProjectWorldData/Content/Generated/P0/L_ProjectWorldKazan.umap",
                          "kind":  "map",
                          "digest_kind":  "sha256",
                          "digest":  "a21abcfbc4eb45bf5d62e294b89cf465e8fb709d28b2e0ff4a6a8e2528fab0dc"
                      },
                      {
                          "path":  "Plugins/World/ProjectWorldData/Content/Generated/P0/L_ProjectWorldKazan_HLODLayer_Instanced.uasset",
                          "kind":  "hlod",
                          "digest_kind":  "sha256",
                          "digest":  "9bc0c3d19417da15d1d51cfe58d65dd7b3271f63e80d5f8f8d1c71b89644d898"
                      },
                      {
                          "path":  "Plugins/World/ProjectWorldData/Content/Generated/P0/L_ProjectWorldKazan_HLODLayer_Merged.uasset",
                          "kind":  "hlod",
                          "digest_kind":  "sha256",
                          "digest":  "b276f483d1ebab14ad5c7b03f481e2e4051d06599f93ff543be20eb35acc06dd"
                      }
                  ],
    "consumer_references":  [

                            ]
}
